{
  "key": "ouchterlony2005swebrec",
  "entry_type": "article",
  "author": "Ouchterlony, Finn",
  "title": "The Swebrec function: linking fragmentation by blasting and crushing",
  "journal": "Mining Technology",
  "volume": "114",
  "number": "1",
  "pages": "29--44",
  "year": 1750,
  "doi": "10.1179/037178405X44539",
  "access": "paywalled"
}
