{
  "key": "wikipedia2026weibull",
  "entry_type": "misc",
  "organization": "Wikipedia contributors",
  "title": "Weibull distribution",
  "year": 2026,
  "url": "https://en.wikipedia.org/wiki/Weibull_distribution",
  "access": "open",
  "licence": "CC-BY-SA-4.0",
  "note": "encyclopedia article; its text is licensed CC BY-SA 4.0"
}
